Sheet: Sheet1
A1: Letter | B1: Frequency Dutch | C1: Frequency Spanish | D1: Dutch | E1: Spanish
A2: a | B2: 7.49 | C2: 11.53 | D2: =20-RC[-2] -> 12.51 | E2: =20-RC[-2] -> 8.47
A3: b | B3: 1.58 | C3: 2.22 | D3: =20-RC[-2] -> 18.42 | E3: =20-RC[-2] -> 17.78
A4: c | B4: 1.24 | C4: 4.02 | D4: =20-RC[-2] -> 18.76 | E4: =20-RC[-2] -> 15.98
A5: d | B5: 5.93 | C5: 5.01 | D5: =20-RC[-2] -> 14.07 | E5: =20-RC[-2] -> 14.99
A6: e | B6: 18.91 | C6: 12.18 | D6: =20-RC[-2] -> 1.09 | E6: =20-RC[-2] -> 7.82
A7: f | B7: 0.81 | C7: 0.69 | D7: =20-RC[-2] -> 19.19 | E7: =20-RC[-2] -> 19.31
A8: g | B8: 3.40 | C8: 1.77 | D8: =20-RC[-2] -> 16.60 | E8: =20-RC[-2] -> 18.23
A9: h | B9: 2.38 | C9: 0.70 | D9: =20-RC[-2] -> 17.62 | E9: =20-RC[-2] -> 19.30
A10: I | B10: 6.50 | C10: 6.25 | D10: =20-RC[-2] -> 13.50 | E10: =20-RC[-2] -> 13.75
A11: j | B11: 1.46 | C11: 0.49 | D11: =20-RC[-2] -> 18.54 | E11: =20-RC[-2] -> 19.51
A12: k | B12: 2.25 | C12: 0.01 | D12: =20-RC[-2] -> 17.75 | E12: =20-RC[-2] -> 19.99
A13: l | B13: 3.57 | C13: 4.97 | D13: =20-RC[-2] -> 16.43 | E13: =20-RC[-2] -> 15.03
A14: m | B14: 2.21 | C14: 3.16 | D14: =20-RC[-2] -> 17.79 | E14: =20-RC[-2] -> 16.84
A15: n | B15: 10.03 | C15: 6.71 | D15: =20-RC[-2] -> 9.97 | E15: =20-RC[-2] -> 13.29
A16: o | B16: 6.06 | C16: 8.68 | D16: =20-RC[-2] -> 13.94 | E16: =20-RC[-2] -> 11.32
A17: p | B17: 1.57 | C17: 2.51 | D17: =20-RC[-2] -> 18.43 | E17: =20-RC[-2] -> 17.49
A18: q | B18: 0.01 | C18: 0.88 | D18: =20-RC[-2] -> 19.99 | E18: =20-RC[-2] -> 19.12
A19: r | B19: 6.41 | C19: 6.87 | D19: =20-RC[-2] -> 13.59 | E19: =20-RC[-2] -> 13.13
A20: s | B20: 3.73 | C20: 7.98 | D20: =20-RC[-2] -> 16.27 | E20: =20-RC[-2] -> 12.02
A21: t | B21: 6.79 | C21: 4.63 | D21: =20-RC[-2] -> 13.21 | E21: =20-RC[-2] -> 15.37
A22: u | B22: 1.99 | C22: 2.93 | D22: =20-RC[-2] -> 18.01 | E22: =20-RC[-2] -> 17.07
A23: v | B23: 2.85 | C23: 1.14 | D23: =20-RC[-2] -> 17.15 | E23: =20-RC[-2] -> 18.86
A24: w | B24: 1.52 | C24: 0.02 | D24: =20-RC[-2] -> 18.48 | E24: =20-RC[-2] -> 19.98
A25: x | B25: 0.04 | C25: 0.22 | D25: =20-RC[-2] -> 19.96 | E25: =20-RC[-2] -> 19.78
A26: y | B26: 0.04 | C26: 1.01 | D26: =20-RC[-2] -> 19.96 | E26: =20-RC[-2] -> 18.99
A27: z | B27: 1.39 | C27: 0.47 | D27: =20-RC[-2] -> 18.61 | E27: =20-RC[-2] -> 19.53